curriculum_id,unit_id,lesson_id,title,description,objective_bullets,duration,display_order
act4,unit-4,lesson-3,Lesson 4.3: Talk to an AI Sprite,Combining speech-to-text with ChatGPT and optional text-to-speech.,,50 minutes,3
act4,unit-4,lesson-4,Lesson 4.4: AI Voice Translator,Integrating speech-to-text with ChatGPT and adding optional text-to-speech.,,50 minutes,4
act4,unit-4,lesson-5,Lesson 4.5: Vision-based AI Assistant,Developing a multi-modal AI that can interpret camera images.,,80 minutes,5
act4,unit-4,lesson-6,Lesson 4.6: Introduction to AI Motion Sensor,Basics of video sensing blocks for movement detection.,,50 minutes,6
act4,unit-4,lesson-7,Lesson 4.7: Bouncing Ball with Motion Sensor,Using motion input to move sprites or detect collisions.,,50 minutes,7
act4,unit-4,optional-1,Optional 1: AI for Hand Tracking,Detecting finger keypoints to recognize gestures.,,120 minutes,8
act4,unit-4,optional-2,Optional 2: Fitness Game Using Body Pose,"Designing a game using body pose input (for example, squatting to move a sprite).",,90 minutes,9
act4,unit-4,lesson-8,Lesson 4.8: Group Project B,"Apply all learned lessons to create a new app, particularly utilizing voice or vision-based AI capabilities.",,200 minutes,10
act4,unit-5a,lesson-1,Lesson 5A.1: Text Summarization: Product Review,"Summarizing or analyzing large blocks of text (e.g., product reviews) using ChatGPT.",,70 minutes,1
act4,unit-5a,lesson-2,Lesson 5A.2: Text Summarization: Web Search,Using the web search block to fetch snippets and then summarizing them with ChatGPT.,,60 minutes,2
act4,unit-5a,lesson-3,Lesson 5A.3: Tool Use: Math Calculations,Instructing ChatGPT to perform math calculations using a calculator tool.,,65 minutes,3
act4,unit-5a,lesson-4,Lesson 5A.4: Tool Use: Web Search,Enabling ChatGPT to utilize a web search tool.,,80 minutes,4
act4,unit-5a,optional-1,Optional 1: Tool Use: An AI-Powered Calendar Assistant,Enable LLM to utilize Google Sheets as storage for calendar events,,120 minutes,5
act4,unit-5a,optional-2,Optional 2: A QA Bot Using Semantic Search (RAG),Building or importing a knowledge base and embedding/indexing it for semantic retrieval.,,110 minutes,6
act4,unit-5a,optional-3,Optional 3: Image Analysis: Number Recognition,Scanning image data block by block to classify shapes.,,110 minutes,7
act4,unit-5a,lesson-5,Lesson 5A.5: Group Project C,"Leveraging advanced LLM capabilities (text processing/summarization, reasoning, tool use, semantic search) to develop a new app.",,200 minutes,8
act4,unit-5b,lesson-1,Lesson 5B.1: Introduction to Agentic Coding,"Explain what is agentic coding, and build an example game step by step",,60 minutes,1
act4,unit-5b,lesson-2,Lesson 5B.2: Debugging with XO Agent's Help,Strategies and practices for debugging with agent's help,,45 minutes,2
act4,unit-5b,lesson-3,Lesson 5B.3: Getting Started with the Agentic Coding Studio,Explain how the studio works and complete a first challenge step by step,,45 minutes,3
act4,unit-5b,lesson-4,Lesson 5B.4: Project A: Cookie Clicker Game,Work on a challenge in the studio,,45 minutes,4
act4,unit-5b,lesson-5,Lesson 5B.5: Project B: Whack-a-Mole Game,Work on a challenge in the studio,,90 minutes,5
act4,unit-5b,lesson-6,Lesson 5B.6: Project C: Flappy Bird Game,Work on a challenge in the studio,,90 minutes,6
act4,unit-5b,lesson-7,Lesson 5B.7: Project D: Tower Defense Game,Work on a challenge in the studio,,90 minutes,7
act4,unit-5b,lesson-8,Lesson 5B.8: Project E: Space Shooter Game,Work on a challenge in the studio,,90 minutes,8
act4,unit-5b,lesson-9,Lesson 5B.9: Capstone Project,,,180 minutes,9
ai_literacy,unit-1,lesson-1,Lesson 1: How Does AI Actually Work?,"Students explore next-word prediction, the role of training data and bias, and four reasons AI answers should always be double-checked.","Explain that AI generates answers by predicting likely next words from patterns in data|Describe the data, numbers, patterns, predict pipeline|Connect narrow or one-sided training data to biased predictions|Give reasons why AI answers should be double-checked",40–45 minutes,1
scratch,unit-1,lesson-1,Lesson 1 Setting Up Scratch Accounts,"This lesson walks students through the process of logging into Scratch for the first time and joining the teacher's Scratch class . There is a ""Tinkering with Scratch"" activity for students to work on as classmates are getting set up.","Walk through the process of logging into Scratch for the first time and joining the teacher's Scratch class|There is a ""Tinkering with Scratch"" activity for independent practice as classmates are getting set up",50 minutes,1
scratch,unit-1,lesson-2,Lesson 2: Introduction to Scratch,This lesson introduces the Scratch environment to students and teaches them to import sprites (characters) and how to edit them.,Introduce the Scratch environment to learners and teaches them to import sprites (characters) and how to edit them,50 minutes,2
scratch,unit-1,lesson-3,Lesson 3: Scratch Charades,Students play a Scratch version of charades and determine the script that is performed by the actor. They learn how block-based programming works without the complexity of the Scratch platform.,Play a Scratch version of charades and determine the script that is performed by the actor|Learn how block-based programming works without the complexity of the Scratch platform,50 minutes,3
scratch,unit-1,lesson-4,"Lesson 4: Coding Concepts 1 - Sequence, Algorithm, Program","Students review the concepts of sequence , algorithm, and program to give them language to talk about the process of creating projects. Students debug code to better understand the importance of initialization. They work on a project called ""Making Things Move and Talk"".","Review the concepts of sequence , algorithm, and program to give them language to talk about the process of creating projects|Debug code to better understand the importance of initialization|Work on a project called ""Making Things Move and Talk""",50 minutes,4
scratch,unit-1,lesson-5,"Lesson 5: Coding Concepts 2 - Events, Loops, Animation","This lesson introduces the concepts of events, loops, and animation. They debug code to discover the importance of ""wait"" blocks in animation. Students make a flip book to help students development their conception of animation.","Introduce the concepts of events, loops, and animation|Debug code to discover the importance of ""wait"" blocks in animation|Make a flip book to help learners development their conception of animation",50 minutes,5
scratch,unit-1,lesson-6,Lesson 6: Broadcasting and Receiving,This lesson introduces students to the concept of broadcasting and receiving. This is an important concept that enables sprites (characters) to interact.,Introduce the concept of broadcasting and receiving|This is an important concept that enables sprites (characters) to interact,50 minutes,6
scratch,unit-2,lesson-1,Name Poem Project,"Students plan, build, and reflect on a project where they animate each letter of their name.","Plan, build, and reflect on a project where they animate each letter of their name",3 hours,1
scratch,unit-2,lesson-2,About Me Project,"Students plan, build, and reflect on a project where they choose their own background, sprites (characters), animation, and script to share about themselves.","Plan, build, and reflect on a project where choose their own background, sprites (characters), animation, and script to share about themselves",3 hours,2
scratch,unit-2,lesson-3,Dance Party Project,"Students plan, build, and reflect on a project where they program sprites to change costumes to create a movement effect.","Plan, build, and reflect on a project where they program sprites to change costumes to create a movement effect",3 hours,3
scratch,unit-2,lesson-4,Role Model Lessons,Here are seven lessons about people from underrepresented groups in the computing field who have made or are making contributions to the computing field. Students explore various occupations in the computing field.,Explore seven lessons about people from underrepresented groups in the computing field who have made or are making contributions to the computing field|Various occupations in the computing field,7 x 15 minutes,4
scratch,unit-2,lesson-5,Environmental Literacy Systems Project- coming soon!,"These lessons teach students that a system is two or more parts that interact to form a whole. Students learn about how trees affect people and how people affect trees. The concept of cause and effect is taught explicitly. For the Scratch project, students narrate the relationships and animate sprites in a tree connection circle.","Teach that a system is two or more parts that interact to form a whole|About how trees affect people and how people affect trees|Explore cause and effect is taught explicitly|For the Scratch project, learners narrate the relationships and animate sprites in a tree connection circle",6 x 50 minutes,5
scratch,unit-2,lesson-6,Growth Mindset and the Brain,This quick project guides students to make a digital Thanksgiving greeting card. Students animate the sprites in the project and record a message. The project can be emailed to friends and family simply by copying and pasting the URL.,This quick project guides make a digital Thanksgiving greeting card|Animate the sprites in the project and record a message|The project can be emailed to friends and family simply by copying and pasting the URL,Three Hours,6
scratch,unit-3,lesson-1,What is a Change-Maker?,Students define what a change-maker is and choose a change-maker to research and report on.,Define what a change-maker is and choose a change-maker to research and report on,1 hour,1
scratch,unit-3,lesson-2,Researching Your Change-Maker,Students generate questions for their research. They take notes systematically.,Generate questions for their research|Take notes systematically,2 hours,2
scratch,unit-3,lesson-3,Planning Your Project,Students animate and narrate the change-maker's story in the Scratch environment. Reflection and Sharing Students reflection the creation process and will share their project with others. Contact Us at ECforALL@uci.edu Back to Top This curriculum is supported in part by the National Science Foundation through Grants #2317832 and #1923136 and by the United States Department of Education through Grant #U411C190092....,Animate and narrate the change-maker's story in the Scratch environment|Reflection and Sharing reflection the creation process and will share their project with others,3 hours,3
